accordion-link	AccordionLink	an accordion link
tel-link	TelLink	a tel hyperlink for a telephone number
text-area-with-character-counter	TextAreaWithCharacterCounter	a multi-line text area with a caption below that is a character counter "[number] of [maximum] characters"
text-input	TextInput	a single-line text input field <input type="text">
text-input-with-search	TextInputWithSearch	a single-line text input field <input type="text"> with search capability
textarea	Textarea	a multi-line text input area
theme-picker	ThemePicker	a picker for selecting a visual theme
theme-picker-button	ThemePickerButton	a picker button for selecting a visual theme
theme-select	ThemeSelect	a select dropdown for choosing a theme
theme-select-option	ThemeSelectOption	one option in a theme select dropdown
theme-view	ThemeView	a read-only display of the current theme
tile	Tile	a grouping container that presents related content in a structured format, often as a single clickable area
time-input	TimeInput	an input for entering a time value <input type="time">
time-picker-input	TimePickerInput	an input with a dropdown for picking a time
timeline-list	TimelineList	an ordered list of chronological events or milestones
timeline-list-item	TimelineListItem	one event in a timeline list
timeout-dialog	TimeoutDialog	a modal dialog warning users before session timeout
timer	Timer	a countdown or elapsed time display
timer-button	TimerButton	a button with a timer that will automatically click after a given amount of time
toast	Toast	a brief auto-dismissing notification message
toggle-button	ToggleButton	a button that toggles between pressed and unpressed states
toggle-group	ToggleGroup	a group of toggle buttons for selecting options
tool-bar	ToolBar	a horizontal bar of tool actions
tool-bar-button	ToolBarButton	one action button in a tool bar
tooltip	Tooltip	a small popup showing descriptive text on hover or focus
tour	Tour	a tour guide, such as for sightseeing, or pathways, or demonstrations, etc.
tour-list	TourList	an ordered list of tour guide steps
tour-list-item	TourListItem	one step in a tour guide list
tree-link	TreeLink	one link in the tree
tree-list	TreeList	a hierarchical list with nested expandable items
tree-list-item	TreeListItem	one item in a tree navigation list
tree-menu	TreeMenu	a hierarchical tree menu with expandable branches
tree-nav	TreeNav	a hierarchical navigation with expandable branches
united-kingdom-national-health-service-number-input	UnitedKingdomNationalHealthServiceNumberInput	an input for entering a UK NHS number
united-kingdom-national-health-service-number-view	UnitedKingdomNationalHealthServiceNumberView	a read-only display of a UK NHS number
united-states-social-security-number-input	UnitedStatesSocialSecurityNumberInput	an input for entering a US Social Security number
united-states-social-security-number-view	UnitedStatesSocialSecurityNumberView	a read-only display of a US Social Security number
url-input	UrlInput	an input for entering a URL <input type="url">
vital-sign-belly-circumference-as-cm-input	VitalSignBellyCircumferenceAsCmInput	number input of one vital sign bell circumference in centimetres with integers
vital-sign-belly-circumference-as-cm-input	VitalSignBellyCircumferenceAsCmInput	number input of one vital sign belly circumference in centimetres with integers
vital-sign-belly-circumference-as-cm-view	VitalSignBellyCircumferenceAsCmView	number display of one vital sign belly circumference in centimetres with integers
vital-sign-blood-pressure-diastolic-as-mmhg-input	VitalSignBloodPressureDiastolicAsMmhgInput	number input of one vital sign blood pressure diastolic with integers
vital-sign-blood-pressure-diastolic-as-mmhg-view	VitalSignBloodPressureDiastolicAsMmhgView	number display of one vital sign blood pressure diastolic with integers
vital-sign-blood-pressure-systolic-as-mmhg-input	VitalSignBloodPressureSystolicAsMmhgInput	number input of one vital sign blood pressure systolic with integers
vital-sign-blood-pressure-systolic-as-mmhg-view	VitalSignBloodPressureSystolicAsMmhgView	number display of one vital sign blood pressure systolic with integers
vital-sign-body-fat-as-percentage-input	VitalSignBodyFatAsPercentageInput	number input of one vital sign body fat percentage with one decimal point
vital-sign-body-fat-as-percentage-view	VitalSignBodyFatAsPercentageView	number display of one vital sign body fat percentage with one decimal point
vital-sign-body-temperature-as-celcius-input	VitalSignBodyTemperatureAsCelciusInput	number input of one vital sign body temperature in Celsius degrees with one decimal point
vital-sign-body-temperature-as-celcius-view	VitalSignBodyTemperatureAsCelciusView	number display of one vital sign body temperature in Celsius degrees with one decimal point
vital-sign-cholesterol-as-hdl-mmol-per-litre-input	VitalSignCholesterolAsHdlMmolPerLitreInput	number input of one vital sign cholesterol HDL (good cholesterol) millimole per litre with one decimal point
vital-sign-cholesterol-as-hdl-mmol-per-litre-view	VitalSignCholesterolAsHdlMmolPerLitreView	number display of one vital sign cholesterol HDL (good cholesterol) millimole per litre with one decimal point
vital-sign-cholesterol-as-ldl-mmol-per-litre-input	VitalSignCholesterolAsLdlMmolPerLitreInput	number input of one vital sign cholesterol LDL (bad cholesterol) millimole per litre with one decimal point
vital-sign-cholesterol-as-ldl-mmol-per-litre-view	VitalSignCholesterolAsLdlMmolPerLitreView	number display of one vital sign cholesterol LDL (bad cholesterol) millimole per litre with one decimal point
vital-sign-heart-rate-as-beats-per-minute-input	VitalSignHeartRateAsBeatsPerMinuteInput	number input of one vital sign heart rate in beats per minute (BPM) with integers
vital-sign-heart-rate-as-beats-per-minute-view	VitalSignHeartRateAsBeatsPerMinuteView	number display of one vital sign heart rate in beats per minute (BPM) with integers
vital-sign-heart-rate-variability-input	VitalSignHeartRateVariabilityInput	number input of one vital sign heart rate variability (HRV) with integers
vital-sign-heart-rate-variability-view	VitalSignHeartRateVariabilityView	number display of one vital sign heart rate variability (HRV) with integers
vital-sign-height-as-cm-input	VitalSignHeightAsCmInput	number input of one vital sign height in centimetres with integers
vital-sign-height-as-cm-view	VitalSignHeightAsCmView	number display of one vital sign height in centimetres with integers
vital-sign-respiratory-rate-as-breaths-per-minute-input	VitalSignRespiratoryRateAsBreathsPerMinuteInput	number input of one vital sign respiratory rate in breaths per minute with integers
vital-sign-respiratory-rate-as-breaths-per-minute-view	VitalSignRespiratoryRateAsBreathsPerMinuteView	number display of one vital sign respiratory rate in breaths per minute with integers
vital-sign-sleep-score-as-0-to-100-input	VitalSignSleepScoreAs0To100Input	number input of one vital sign sleep score with range 0-100
vital-sign-sleep-score-as-0-to-100-view	VitalSignSleepScoreAs0To100View	number display of one vital sign sleep score with range 0-100
vital-sign-total-sleep-time-as-min-per-day-input	VitalSignTotalSleepTimeAsMinPerDayInput	number input of one vital sign total sleep time as minutes per day
vital-sign-total-sleep-time-as-min-per-day-view	VitalSignTotalSleepTimeAsMinPerDayView	number display of one vital sign total sleep time as minutes per day
vital-sign-vo2-max-as-ml-per-kg-per-minute-input	VitalSignVo2MaxAsMlPerKgPerMinuteInput	number input of one vital sign VO2 max in millilitres per kilogram per minute with integers
vital-sign-vo2-max-as-ml-per-kg-per-minute-view	VitalSignVo2MaxAsMlPerKgPerMinuteView	number display of one vital sign VO2 max in millilitres per kilogram per minute with integers
vital-sign-waist-circumference-as-cm-input	VitalSignWaistCircumferenceAsCmInput	number input of one vital sign waist circumference in centimetres with integers
vital-sign-waist-circumference-as-cm-view	VitalSignWaistCircumferenceAsCmView	number display of one vital sign waist circumference in centimetres with integers
vital-sign-weight-as-kg-input	VitalSignWeightAsKgInput	number input of one vital sign weight in kilograms with integers
vital-sign-weight-as-kg-view	VitalSignWeightAsKgView	number display of one vital sign weight in kilograms with integers
warning-callout	WarningCallout	a callout box highlighting a warning message
week-input	WeekInput	an input for selecting a week and year <input type="week">
